id;hex_id;name;description;tag_1;tag_2;node/relationship;attribute;;;
101D178A67D96698;101D178A67D96698;Categorie delle applicazioni;Le applicazioni vengono categorizzate in base ad un campo che si chiama application category che differenzia le app in base ai seguenti valori: 1) Business Application - identifica una applicazione che supporta direttamente il business nei suoi processi oppure che è acceduta dagli utenti Business, 2) Business Application (external) - identifica un'applicazione che supporta il Business ma che di solito è gestita esternamente al perimetro aziendali da terze parti o partner, quindi il governo e la governance su queste applicazioni è limitato dalla nostra limitata influenza sulla roadmap dell'applicazione, 3) Corporate Application - identifica quelle applicazioni o servizi che sono usati dalle funzioni Corporate (Corporate Security, IT, Human Resource, Risk Management, ..) per espletare i processi aziendali a supporto delle Business line, 4) Corporate IT Services - identificano quelle applicazioni o servizi che supportano altre applicazioni (e.g. la virtualizzazione dei server, lo storage, le piattaforme di containerization, ..). Rappresentano i servizi core a supporto e rientrano in questo gruppo anche applicazioni IT base che vengono erogate all'azienda (e.g. servizi di posta), 5) IT Application - rappresentano applicazioni che supportano le applicazioni di Business ma sono componenti più tecnici che vengono disegnati nell'architettura dell'applicativo e non sempre sono conosciuti dalla linea di Business, ad ogni modo sono gli elementi portanti di alcune delle architetture applicative aziendali ;Application Category;;;;;;
101D177A67D9666E;101D177A67D9666E;Servizio critico;Un servizio critico è un servizio che supporta dei processi valutati come critici dall'azienda attraverso un assessment BIA (Business impact analysis) sul catalogo di processi aziendali in base alla prioritizzazione delle funzioni e servizi critici della Banca. A livello di eGEA tale campo è presente per le applicazioni che sono censite come servizi attraverso il campo ITSM Status (IT Service Management Status). In caso di DRP (Dysaster Recovery Plan), è possibile identificare eventuali servizi critici di secondo livello che sono fondamentali per il corretto funzionamento di un altro servizio critico che supporta direttamente processi e funzioni critiche. In questo caso sia il servizio critico che supporta direttamente il business che i servizi critici a supporto vengono categorizzati come critici e quindi inseriti all'interno dell'ambito di BCM/DRP. ;Critical Service;;;;;;
CF552E4B67D8830F;CF552E4B67D8830F;Servizio;Un servizio su eGEA è un'applicazione che ha una valenza rilevante per essere inclusa nel catalogo dei servizi aziendali. E' possibile per esempio aprire incident sui servizi utilizzando il servizio CR3AT. Esiste un campo chiamato ITSM Status (IT Service Management Status) che permette di censire appunto la valenza di servizio di una certa applicazione;Service;;;;;;
CF552C7A67D882C5;CF552C7A67D882C5;Applicazione;Un'applicazione è un sistema software che supporta una o più attività specifiche all'interno di un'organizzazione. Può essere utilizzata per automatizzare processi, gestire dati o fornire funzionalità agli utenti. Le applicazioni sono tipicamente progettate per servire uno scopo specifico, come un software per la gestione delle risorse umane o un sistema per l'elaborazione dei pagamenti.;;;;;;;
;;;;;;;;;;
Un'applicazione può interagire con altre applicazioni o sistemi e può essere suddivisa in moduli o componenti per gestire funzioni diverse.;;;;;;;;;;
"Di solito censiamo come applicazione oggetti di codice che possano venir rilasciati in produzione come oggetti deployabili.""";Application;;;;;;;;;
